{
  "schema_version": "1.0",
  "brand_id": "calapres",
  "identity_link_id": "idl_synthetic0001",
  "channel": "whatsapp",
  "chatwoot_contact_ref": "cwct_synthetic001",
  "source_id_fingerprint": "aaaaaaaaaaaaaaaaaaaaaaaaaaaaaaaaaaaaaaaaaaaaaaaaaaaaaaaaaaaaaaaa",
  "fingerprint_key_version": "hmac-sha256-v1",
  "customer_ref": {
    "system": "shopify",
    "id": "synthetic_customer_001"
  },
  "verification": {
    "status": "verified",
    "method": "exact_channel",
    "verified_at": "2026-08-11T12:02:00+03:00",
    "revoked_at": null,
    "evidence_ref": "ver_synthetic0001"
  },
  "created_at": "2026-08-11T12:02:00+03:00",
  "updated_at": "2026-08-11T12:02:00+03:00"
}
